{
  "$schema": "https://json-schema.org/draft/2020-12/schema",
  "$id": "https://example.invalid/everything-exam-preparation/public_lecture_notes_plan.schema.json",
  "title": "PublicLectureNotesPlan",
  "type": "object",
  "required": [
    "object_type",
    "title",
    "target_group_key",
    "source_scale_budget",
    "output_language_profile",
    "route_docx_style_profile",
    "public_lecture_sections"
  ],
  "properties": {
    "object_type": {
      "const": "PublicLectureNotesPlan"
    },
    "notes_plan_id": {
      "type": "string"
    },
    "walkthrough_id": {
      "type": "string"
    },
    "title": {
      "type": "string",
      "minLength": 1
    },
    "target_group_key": {
      "type": "string",
      "minLength": 1
    },
    "source_scale_budget": {
      "$ref": "#/$defs/SourceScaleBudget"
    },
    "output_language_profile": {
      "$ref": "#/$defs/OutputLanguageProfile"
    },
    "route_docx_style_profile": {
      "$ref": "#/$defs/RouteDocxStyleProfile"
    },
    "public_lecture_sections": {
      "type": "array",
      "minItems": 1,
      "items": {
        "$ref": "#/$defs/PublicLectureSection"
      }
    }
  },
  "not": {
    "anyOf": [
      {
        "required": [
          "course_knowledge_map"
        ]
      },
      {
        "required": [
          "course_modules"
        ]
      },
      {
        "required": [
          "legacy_course_sections"
        ]
      },
      {
        "required": [
          "legacy_public_output_points"
        ]
      },
      {
        "required": [
          "legacy_lectures"
        ]
      },
      {
        "required": [
          "knowledge_cards"
        ]
      },
      {
        "required": [
          "exam_overlay_pass"
        ]
      },
      {
        "required": [
          "question_type_addons"
        ]
      }
    ]
  },
  "$defs": {
    "SourceScaleBudget": {
      "type": "object",
      "required": [
        "source_units_count",
        "readable_source_blocks",
        "protected_knowledge_units_total",
        "excluded_non_knowledge_units_total",
        "target_public_units_min",
        "target_words_min",
        "compression_mode",
        "coverage_floor_status"
      ],
      "properties": {
        "source_units_count": {
          "type": "integer",
          "minimum": 0
        },
        "readable_source_blocks": {
          "type": "integer",
          "minimum": 0
        },
        "source_pages_or_slides_estimate": {
          "type": "integer",
          "minimum": 0
        },
        "source_information_profile_status": {
          "enum": [
            "measured",
            "estimated",
            "missing",
            "not_applicable"
          ]
        },
        "informative_page_count": {
          "type": "integer",
          "minimum": 0
        },
        "non_informative_page_count": {
          "type": "integer",
          "minimum": 0
        },
        "information_mass_units": {
          "type": "number",
          "minimum": 0
        },
        "average_information_score": {
          "type": "number",
          "minimum": 0
        },
        "page_information_profile": {
          "type": "array",
          "items": {
            "type": "object",
            "additionalProperties": true
          }
        },
        "source_types": {
          "type": "array",
          "items": {
            "type": "string"
          }
        },
        "protected_knowledge_units_total": {
          "type": "integer",
          "minimum": 0
        },
        "excluded_non_knowledge_units_total": {
          "type": "integer",
          "minimum": 0
        },
        "target_public_units_min": {
          "type": "integer",
          "minimum": 0
        },
        "target_words_min": {
          "type": "integer",
          "minimum": 0
        },
        "target_words_max": {
          "type": "integer",
          "minimum": 0
        },
        "compression_mode": {
          "enum": [
            "explain_not_dump",
            "concise",
            "standard",
            "expanded",
            "multi_volume_required"
          ]
        },
        "compression_reason": {
          "type": "string"
        },
        "coverage_floor_status": {
          "enum": [
            "pass",
            "warn",
            "block"
          ]
        }
      },
      "additionalProperties": false
    },
    "OutputLanguageProfile": {
      "type": "object",
      "required": [
        "output_language"
      ],
      "properties": {
        "output_language": {
          "type": "string",
          "minLength": 1
        },
        "allow_bilingual": {
          "type": "boolean",
          "default": false
        },
        "allow_non_english": {
          "type": "boolean",
          "default": false
        },
        "preserve_technical_terms": {
          "type": "boolean",
          "default": true
        }
      },
      "additionalProperties": false
    },
    "PublicLectureSection": {
      "type": "object",
      "required": [
        "lecture_title",
        "modules"
      ],
      "properties": {
        "lecture_title": {
          "type": "string",
          "minLength": 1
        },
        "lecture_scope": {
          "type": "string"
        },
        "modules": {
          "type": "array",
          "minItems": 1,
          "items": {
            "$ref": "#/$defs/PublicLectureModule"
          }
        }
      },
      "additionalProperties": false
    },
    "PublicLectureModule": {
      "type": "object",
      "required": [
        "module_title",
        "knowledge_functions",
        "explanation",
        "blocks"
      ],
      "properties": {
        "module_title": {
          "type": "string",
          "minLength": 1
        },
        "knowledge_functions": {
          "type": "array",
          "minItems": 2,
          "uniqueItems": true,
          "items": {
            "enum": [
              "definition_boundary",
              "mechanism_process",
              "method_readout",
              "graph_data_interpretation",
              "calculation_unit_worked_example",
              "named_example",
              "limitation_trap"
            ]
          }
        },
        "explanation": {
          "type": "string",
          "minLength": 160
        },
        "blocks": {
          "type": "array",
          "minItems": 1,
          "items": {
            "$ref": "#/$defs/PublicLectureBlock"
          }
        },
        "visual_refs": {
          "type": "array",
          "items": {
            "type": "string"
          }
        }
      },
      "additionalProperties": false
    },
    "PublicLectureBlock": {
      "type": "object",
      "required": [
        "block_type",
        "content"
      ],
      "properties": {
        "block_type": {
          "enum": [
            "definition",
            "mechanism",
            "method",
            "graph_data",
            "calculation",
            "example",
            "limitation",
            "comparison",
            "table",
            "explanation"
          ]
        },
        "label": {
          "type": "string"
        },
        "content": {
          "oneOf": [
            {
              "type": "string",
              "minLength": 1
            },
            {
              "type": "array",
              "minItems": 1,
              "items": {
                "type": "string",
                "minLength": 1
              }
            }
          ]
        }
      },
      "additionalProperties": false
    },
    "RouteDocxStyleProfile": {
      "type": "object",
      "required": [
        "route",
        "margin_cm",
        "line_spacing",
        "body_alignment",
        "title_alignment",
        "heading_alignment",
        "image_alignment",
        "body_font_pt",
        "text_color",
        "theme_colours_allowed",
        "blue_heading_styles_allowed"
      ],
      "properties": {
        "route": {
          "enum": [
            "exam_prep_notes_docx",
            "knowledge_walkthrough_docx"
          ]
        },
        "margin_cm": {
          "type": "number",
          "minimum": 1.92,
          "maximum": 2.08
        },
        "line_spacing": {
          "type": "number",
          "minimum": 1.05,
          "maximum": 1.15
        },
        "body_alignment": {
          "const": "left"
        },
        "title_alignment": {
          "const": "left"
        },
        "heading_alignment": {
          "const": "left"
        },
        "image_alignment": {
          "const": "center"
        },
        "body_font_pt": {
          "type": "number",
          "minimum": 9.5,
          "maximum": 11.5
        },
        "title_font_pt": {
          "type": "number",
          "minimum": 13.0,
          "maximum": 16.0
        },
        "lecture_heading_font_pt": {
          "type": "number",
          "minimum": 12.0,
          "maximum": 15.0
        },
        "module_heading_font_pt": {
          "type": "number",
          "minimum": 10.5,
          "maximum": 13.0
        },
        "text_color": {
          "const": "black"
        },
        "lecture_page_breaks": {
          "type": "boolean",
          "default": false
        },
        "theme_colours_allowed": {
          "const": false
        },
        "blue_heading_styles_allowed": {
          "const": false
        }
      },
      "additionalProperties": false
    }
  },
  "additionalProperties": false
}
