{
  "object_type": "PublicLectureNotesPlan",
  "notes_plan_id": "sample_public_lecture_notes",
  "title": "Lecture Knowledge Walkthrough",
  "target_group_key": "sample_course",
  "source_scale_budget": {
    "source_units_count": 2,
    "readable_source_blocks": 8,
    "protected_knowledge_units_total": 4,
    "excluded_non_knowledge_units_total": 1,
    "target_public_units_min": 8,
    "target_words_min": 420,
    "compression_mode": "explain_not_dump",
    "coverage_floor_status": "pass"
  },
  "output_language_profile": {
    "output_language": "English",
    "allow_bilingual": false
  },
  "route_docx_style_profile": {
    "route": "exam_prep_notes_docx",
    "margin_cm": 2.0,
    "line_spacing": 1.1,
    "body_alignment": "left",
    "title_alignment": "left",
    "heading_alignment": "left",
    "image_alignment": "center",
    "body_font_pt": 10.5,
    "title_font_pt": 14.0,
    "lecture_heading_font_pt": 13.0,
    "module_heading_font_pt": 11.5,
    "text_color": "black",
    "lecture_page_breaks": false,
    "theme_colours_allowed": false,
    "blue_heading_styles_allowed": false
  },
  "public_lecture_sections": [
    {
      "lecture_title": "Lecture 1: Membranes as selective chemical boundaries",
      "modules": [
        {
          "module_title": "Bilayer chemistry explains selective permeability",
          "knowledge_functions": [
            "definition_boundary",
            "mechanism_process"
          ],
          "explanation": "A phospholipid bilayer is a chemical boundary because hydrophilic head groups face water while hydrophobic tails form an internal non-polar core. Small non-polar molecules cross more easily than ions because charged solutes must shed hydration shells and enter an energetically unfavourable core.",
          "blocks": [
            {
              "block_type": "limitation",
              "content": "Permeability is not absolute: transport proteins change the effective boundary for specific ions or polar solutes."
            }
          ]
        },
        {
          "module_title": "Fluidity controls how membrane proteins can move and interact",
          "knowledge_functions": [
            "mechanism_process",
            "limitation_trap"
          ],
          "explanation": "Membrane fluidity describes lateral movement within the bilayer and depends on lipid packing. Unsaturated tails reduce packing, while cholesterol buffers extremes by limiting movement at high temperature and preventing tight packing at low temperature. This matters because protein collision, signalling complex assembly and vesicle deformation all require movement without losing the membrane boundary.",
          "blocks": [
            {
              "block_type": "limitation",
              "content": "Fluidity does not mean the membrane is disorganised; it means movement is constrained enough to preserve a boundary while allowing protein interactions."
            }
          ]
        },
        {
          "module_title": "Selective permeability creates a need for transport proteins",
          "knowledge_functions": [
            "definition_boundary",
            "named_example"
          ],
          "explanation": "Selective permeability means the bilayer allows some substances through faster than others. Oxygen and carbon dioxide diffuse readily, whereas ions and most polar metabolites need channels, carriers or pumps because the hydrophobic core creates an energetic barrier.",
          "blocks": [
            {
              "block_type": "example",
              "content": "Ion channels illustrate the boundary because they create a protein-lined route through a membrane that the ion cannot cross efficiently by dissolving in the lipid core."
            }
          ]
        },
        {
          "module_title": "Compartment membranes let cells separate incompatible chemistry",
          "knowledge_functions": [
            "mechanism_process",
            "named_example"
          ],
          "explanation": "Internal membranes allow different reactions to occur in different chemical environments. This matters because enzymes, ion concentrations and redox conditions can be tuned locally rather than averaged across the whole cytoplasm. An organelle boundary therefore turns one cell into several controlled reaction spaces instead of one mixed solution.",
          "blocks": [
            {
              "block_type": "example",
              "content": "An acidic lumen and a neutral cytosol illustrate compartment logic because the membrane restricts uncontrolled mixing while allowing selected transport."
            }
          ]
        }
      ]
    },
    {
      "lecture_title": "Lecture 2: Transport proteins convert gradients into flux",
      "modules": [
        {
          "module_title": "Electrochemical gradients combine concentration and voltage",
          "knowledge_functions": [
            "mechanism_process",
            "calculation_unit_worked_example"
          ],
          "explanation": "An electrochemical gradient has a concentration component and an electrical component. A cation may move down its concentration gradient but against the membrane voltage, so the direction of net movement depends on the combined free-energy difference rather than concentration alone.",
          "blocks": [
            {
              "block_type": "calculation",
              "label": "Worked example",
              "content": "For an ion, compare the chemical term with the voltage term because the larger favourable term determines whether net flux is inward or outward."
            }
          ]
        },
        {
          "module_title": "Channels and carriers differ in how they limit flux",
          "knowledge_functions": [
            "definition_boundary",
            "method_readout"
          ],
          "explanation": "Channels form pores that allow rapid movement when open, while carriers bind solute and change conformation. The distinction matters experimentally because channels show high conductance and gating, whereas carriers show saturable transport as binding sites become occupied.",
          "blocks": [
            {
              "block_type": "comparison",
              "content": "A channel is limited mainly by opening and ion passage; a carrier is limited by binding, conformational change and release."
            }
          ]
        },
        {
          "module_title": "Active transport couples uphill movement to an energy source",
          "knowledge_functions": [
            "mechanism_process",
            "limitation_trap"
          ],
          "explanation": "Active transport moves a solute against its electrochemical gradient by coupling transport to ATP hydrolysis, light, redox energy or another gradient. The coupled reaction makes the overall free-energy change favourable even when the solute step alone is unfavourable.",
          "blocks": [
            {
              "block_type": "limitation",
              "content": "Uphill movement cannot be inferred from concentration alone; the membrane voltage and coupled energy source must also be considered."
            }
          ]
        },
        {
          "module_title": "Transport measurements need controls for leak and driving force",
          "knowledge_functions": [
            "method_readout",
            "graph_data_interpretation"
          ],
          "explanation": "A transport assay is interpretable only when the driving force and leak background are defined. Controls without transporter, without substrate or without energy source distinguish transporter-dependent flux from diffusion, vesicle damage or detection background. The readout is therefore a controlled comparison rather than a raw signal increase.",
          "blocks": [
            {
              "block_type": "graph_data",
              "content": "A saturating curve supports carrier-limited transport, while a linear leak-like signal suggests uncontrolled diffusion or assay background."
            }
          ]
        }
      ]
    }
  ]
}
